{
  "schema_version": 1,
  "model": "sirb-gnss-gauss-markov",
  "provenance": {
    "source_name": "Carvalho et al. (2023), Sensors 23(21):8835, Table 1",
    "url": "https://doi.org/10.3390/s23218835",
    "licence": "CC BY 4.0 (stated on the article page)",
    "retrieval_date": "2026-10-18",
    "derived_by": "scripts/derive_gnss_relative.py from data/carvalho2023_sensors_table1.csv",
    "notes": "bias_sigma = mean horizontal error after common mode cancellation over a 1.184 km baseline (0.713 m, against 1.202 m standalone in the same run) / sqrt(pi/2) (circular Gaussian), rounded to 0.1 mm. Literature value for one low cost receiver on a moving rover with a high grade reference, not a measurement of show drones; mapping and setting are judgements, so all values stay assumed. Other values: degraded_fraction 0.25 (scenario of docs/SENSITIVITY.md) and the StressConfig defaults."
  },
  "parameters": {
    "white_sigma": {
      "value": 0.015,
      "unit": "m",
      "assumed": true
    },
    "degraded_fraction": {
      "value": 0.25,
      "unit": "1",
      "assumed": true
    },
    "bias_sigma": {
      "value": 0.5689,
      "unit": "m",
      "assumed": true
    },
    "bias_tau": {
      "value": 30.0,
      "unit": "s",
      "assumed": true
    },
    "dropout_fraction": {
      "value": 0.0,
      "unit": "1",
      "assumed": true
    },
    "dropout_duration": {
      "value": 10.0,
      "unit": "s",
      "assumed": true
    },
    "dead_reckoning_rate": {
      "value": 0.3,
      "unit": "m/sqrt(s)",
      "assumed": true
    }
  }
}
